{
  "orchestrator": {
    "shutdownTimeout": 2000,
    "processSpawnRetries": 3,
    "lockFileTimeout": 5000,
    "watchDebounce": 100,
    "watchStabilityThreshold": 200,
    "watchPollInterval": 50
  },
  "taskRunner": {
    "maxRefinementAttempts": 2,
    "stageTimeout": 300000,
    "llmRequestTimeout": 60000,
    "maxAttempts": 3
  },
  "llm": {
    "defaultProvider": "deepseek",
    "defaultModel": "deepseek-chat",
    "maxConcurrency": 5,
    "retryMaxAttempts": 3,
    "retryBackoffMs": 1000,
    "models": {
      "openai:gpt-4": {
        "provider": "openai",
        "model": "gpt-4"
      },
      "openai:gpt-4-turbo": {
        "provider": "openai",
        "model": "gpt-4-turbo"
      },
      "openai:gpt-5": {
        "provider": "openai",
        "model": "gpt-5-chat-latest"
      },
      "deepseek:reasoner": {
        "provider": "deepseek",
        "model": "deepseek-reasoner"
      },
      "deepseek:chat": {
        "provider": "deepseek",
        "model": "deepseek-chat"
      },
      "anthropic:opus": {
        "provider": "anthropic",
        "model": "claude-3-opus"
      },
      "anthropic:sonnet": {
        "provider": "anthropic",
        "model": "claude-3-sonnet"
      }
    }
  },
  "ui": {
    "port": 3000,
    "host": "localhost",
    "heartbeatInterval": 30000,
    "maxRecentChanges": 10
  },
  "paths": {
    "dataDir": "pipeline-data",
    "configDir": "pipeline-config",
    "pendingDir": "pending",
    "currentDir": "current",
    "completeDir": "complete"
  },
  "validation": {
    "seedNameMinLength": 1,
    "seedNameMaxLength": 100,
    "seedNamePattern": "^[a-zA-Z0-9-_]+$"
  },
  "logging": {
    "level": "info",
    "format": "json",
    "destination": "stdout"
  }
}
